{
  "brief_hash": "5ba8958d",
  "batch_no": "005",
  "stage": "keyword_extract",
  "postings": [
    {
      "posting_id": "p033",
      "company_name": "(주)하이컨시",
      "company_size": "scaleup",
      "domain": "education",
      "role_title": "(주)하이컨시(시대인재) 백엔드 개발자 모집",
      "reference_link": "https://www.saramin.co.kr/zf_user/jobs/relay/view?rec_idx=54096907",
      "items": [
        {
          "item_id": "p033-k001",
          "item_type": "product_context",
          "section": "company_intro",
          "source_spans": [
            {
              "text": "퀘스티(Questi) 팀은 하이컨시(시대인재) 소속의 에듀테크 개발팀으로 기술을 통해 모든 학습자에게 더 나은 학습경험 제공을 목표로 하고 있습니다."
            },
            {
              "text": "• 퀘스티(questi.kr): 문제풀이 기반 학습 서비스"
            },
            {
              "text": "• 세모해(semohae.com): 중, 고등학생 수학 문제풀이 서비스"
            },
            {
              "text": "• 하이큐썸(hiqsum.com): 대화형 문제풀이 서비스"
            }
          ],
          "terms": [
            "에듀테크 개발팀",
            "학습경험",
            "문제풀이 기반 학습 서비스",
            "중, 고등학생 수학 문제풀이 서비스",
            "대화형 문제풀이 서비스"
          ]
        },
        {
          "item_id": "p033-k002",
          "item_type": "culture",
          "section": "culture",
          "source_spans": [
            {
              "text": "• 프로젝트를 주도적으로 이끌어본 경험이 있으신 분"
            },
            {
              "text": "• 새로운 기술을 배우는데 즐거움을 느끼시는 분"
            },
            {
              "text": "• 협업과 커뮤니케이션 중요성에 공감하시는 분"
            }
          ],
          "terms": [
            "프로젝트 주도 경험",
            "새로운 기술 학습",
            "협업과 커뮤니케이션"
          ]
        },
        {
          "item_id": "p033-k003",
          "item_type": "responsibility",
          "section": "responsibilities",
          "source_spans": [
            {
              "text": "• MSA 기반 문제 데이터베이스 구축 및 관리 플랫폼 개발"
            }
          ],
          "terms": [
            "msa",
            "문제 데이터베이스 구축",
            "관리 플랫폼 개발"
          ]
        },
        {
          "item_id": "p033-k004",
          "item_type": "seniority",
          "section": "required_qualifications",
          "source_spans": [
            {
              "text": "• 경력 4년 이상"
            }
          ],
          "terms": [
            "경력 4년 이상"
          ]
        },
        {
          "item_id": "p033-k005",
          "item_type": "technical_stack",
          "section": "tech_stack",
          "source_spans": [
            {
              "text": "• Backend Framework: FastAPI, Gin"
            },
            {
              "text": "• Language: Python, Golang"
            },
            {
              "text": "• Database: MongoDB, PostgresQL (+pgvector)"
            },
            {
              "text": "• Cloud: GCP, Azure"
            }
          ],
          "terms": [
            "fastapi",
            "gin",
            "python",
            "golang",
            "mongodb",
            "postgresql",
            "pgvector",
            "gcp",
            "azure"
          ]
        },
        {
          "item_id": "p033-k006",
          "item_type": "required_experience",
          "section": "preferred_qualifications",
          "source_spans": [
            {
              "text": "• 클라우드 환경 경험자를 선호해요"
            },
            {
              "text": "• 프론트엔드 직무 경험"
            },
            {
              "text": "• MSA 기반 프로젝트 경험"
            }
          ],
          "terms": [
            "클라우드 환경 경험",
            "프론트엔드 직무 경험",
            "msa 기반 프로젝트 경험"
          ]
        },
        {
          "item_id": "p033-k007",
          "item_type": "benefit",
          "section": "benefits",
          "source_spans": [
            {
              "text": "• 점심/저녁 식비를 실비로 지급해드려요"
            },
            {
              "text": "• 간식과 커피가 제공됩니다"
            }
          ],
          "terms": [
            "점심/저녁 식비",
            "간식",
            "커피"
          ]
        },
        {
          "item_id": "p033-k008",
          "item_type": "process",
          "section": "hiring_process",
          "source_spans": [
            {
              "text": "전형절차 : 서류전형 → 과제면접 → 2차면접 → 최종합격"
            }
          ],
          "terms": [
            "서류전형",
            "과제면접",
            "2차면접",
            "최종합격"
          ]
        }
      ],
      "warnings": []
    },
    {
      "posting_id": "p034",
      "company_name": "(주)엑셈",
      "company_size": "scaleup",
      "domain": "ai",
      "role_title": "Java 백엔드 개발자 (2년 이상)",
      "reference_link": "https://www.saramin.co.kr/zf_user/jobs/relay/view?rec_idx=54041224",
      "items": [
        {
          "item_id": "p034-k001",
          "item_type": "responsibility",
          "section": "responsibilities",
          "source_spans": [
            {
              "text": "• 튜닝 엔진 연동·스케줄러 개발"
            },
            {
              "text": "- 튜닝 엔진을 호출하는 스케줄러 설계 ·개발"
            },
            {
              "text": "- 운영 DB에서 고부하 SQL을 조회 ·분류하고 튜닝 후보를 선별하는 파이프라인 설계"
            },
            {
              "text": "- 제안 적용 전후의 비용 ·응답시간을 비교하는 효과 검증 체계 구축"
            }
          ],
          "terms": [
            "튜닝 엔진",
            "스케줄러 설계",
            "운영 db",
            "고부하 sql",
            "튜닝 후보",
            "파이프라인 설계",
            "효과 검증 체계"
          ]
        },
        {
          "item_id": "p034-k002",
          "item_type": "responsibility",
          "section": "responsibilities",
          "source_spans": [
            {
              "text": "• 작업 처리 인프라 개발"
            },
            {
              "text": "- 튜닝 작업의 큐 관리 ·상태 머신 ·스케줄 실행 로직 설계"
            },
            {
              "text": "- 장시간 실행되는 작업의 동시성 제어, 재시도, 오류 복구 설계"
            },
            {
              "text": "- 작업 진행 상황과 결과를 추적 ·저장하는 구조 설계"
            }
          ],
          "terms": [
            "작업 처리 인프라",
            "큐 관리",
            "상태 머신",
            "스케줄 실행 로직",
            "동시성 제어",
            "재시도",
            "오류 복구"
          ]
        },
        {
          "item_id": "p034-k003",
          "item_type": "responsibility",
          "section": "responsibilities",
          "source_spans": [
            {
              "text": "• 운영 안정성 확보"
            },
            {
              "text": "- PostgreSQL 기반 메타 저장소 마이그레이션 전략 설계 및 운영"
            },
            {
              "text": "- 여러 DBMS(Oracle, PostgreSQL, MySQL 등) 연동 어댑터 개발"
            }
          ],
          "terms": [
            "운영 안정성",
            "postgresql",
            "메타 저장소",
            "마이그레이션 전략",
            "oracle",
            "mysql",
            "dbms 연동 어댑터"
          ]
        },
        {
          "item_id": "p034-k004",
          "item_type": "responsibility",
          "section": "responsibilities",
          "source_spans": [
            {
              "text": "• 데이터 관리 및 보안"
            },
            {
              "text": "- 고객사 DB 접속 정보와 SQL 원문 등 민감 데이터의 접근 권한 제어"
            },
            {
              "text": "- 감사 로그 설계"
            }
          ],
          "terms": [
            "데이터 관리",
            "보안",
            "고객사 db 접속 정보",
            "sql 원문",
            "민감 데이터",
            "접근 권한 제어",
            "감사 로그"
          ]
        },
        {
          "item_id": "p034-k005",
          "item_type": "seniority",
          "section": "required_qualifications",
          "source_spans": [
            {
              "text": "• 경력 : 2년 이상"
            }
          ],
          "terms": [
            "경력 2년 이상"
          ]
        },
        {
          "item_id": "p034-k006",
          "item_type": "required_experience",
          "section": "required_qualifications",
          "source_spans": [
            {
              "text": "• Java 백엔드 서비스를 설계하고 프로덕션에서 직접 운영해본 경험"
            },
            {
              "text": "• REST API 설계, DB 모델링에 대한 실무 경험"
            },
            {
              "text": "• SQL과 관계형 데이터베이스에 대한 이해 (실행계획을 읽고 쿼리 성능을 분석해본 경험)"
            },
            {
              "text": "• Docker 기반으로 서비스를 패키징 ·배포해본 경험"
            },
            {
              "text": "• 코드와 의사결정을 문서로 남기는 습관"
            }
          ],
          "terms": [
            "java 백엔드 서비스",
            "프로덕션 운영",
            "rest api 설계",
            "db 모델링",
            "sql",
            "관계형 데이터베이스",
            "실행계획",
            "쿼리 성능 분석",
            "docker",
            "패키징",
            "배포",
            "문서"
          ]
        },
        {
          "item_id": "p034-k007",
          "item_type": "required_experience",
          "section": "preferred_qualifications",
          "source_spans": [
            {
              "text": "• 데이터베이스 성능 튜닝, 인덱스 설계, 옵티마이저 동작에 대한 깊은 이해"
            },
            {
              "text": "• Oracle, PostgreSQL, MySQL 등 복수 DBMS 운영 경험"
            },
            {
              "text": "• 온프레미스 또는 폐쇄망 환경에서 서비스를 배포·운영해본 경험"
            },
            {
              "text": "• Kubernetes 환경 운영 경험"
            },
            {
              "text": "• B2B SaaS 또는 엔터프라이즈 솔루션 개발 경험"
            }
          ],
          "terms": [
            "데이터베이스 성능 튜닝",
            "인덱스 설계",
            "옵티마이저",
            "oracle",
            "postgresql",
            "mysql",
            "복수 dbms 운영",
            "온프레미스",
            "폐쇄망",
            "kubernetes",
            "b2b saas",
            "엔터프라이즈 솔루션"
          ]
        }
      ],
      "warnings": []
    },
    {
      "posting_id": "p035",
      "company_name": "(주)아이스크림미디어",
      "company_size": "scaleup",
      "domain": "education",
      "role_title": "백엔드 개발자 모집",
      "reference_link": "https://www.saramin.co.kr/zf_user/jobs/relay/view?rec_idx=53749052",
      "items": [
        {
          "item_id": "p035-k001",
          "item_type": "responsibility",
          "section": "responsibilities",
          "source_spans": [
            {
              "text": "• 서비스 운영 및 고도화 개발"
            },
            {